"date","day_type","sleep_hours","sleep_quality","exercise","energy","study_hours","focus","spending","income","spend_memo","income_memo","notes","life_score"
"2026-03-09 20:38:56.603012","Study-heavy","5","Low","Walk","Low","5","High","43360.0","0.0","Tiền di chuyển tháng trước","","Hôm qua 2 ca làm tổng 15 tiếng, từ 7r sáng đến 23r mới về đến nhà, xong vì mải tạo ứng dụng này (100% vibe-coding) thì tôi đã đến 4h mới ngủ nên nay phải trả giá, và cũng không đi tập gym được hôm nay.
Và tuy là càng học càng thấy việc học có hứng thú nhưng mà trái ngược lại thì càng học tôi lại càng thấy có quá nhiều thứ phải học và càng cảm thấy tuyệt vọng hơn.
Dù trong đầu tôi suy nghĩ rất nhiều nhưng khi viết ra lại phải tự kiểm tra chính tả với cả nghĩ từ trong đầu ra để viết, nên nó không còn quá tự nhiên nữa. Tôi tạo ra chương trình này để phục vụ mục đích là theo dõi sức khoẻ của tôi, lấy RTD để làm dữ liệu cho AI phân tích cuộc sống, tất cả mọi mặt, và sau đó mới là học ngược lại để hiểu bài code này và các chức năng trong đó, sau đó sẽ càng ngày càng mở rộng bài code này. Tuy nhiên đây là một hành trình có thể là rất dài và nếu dự án phát triển theo thời gian thì có thể sẽ là một trong dự án đi theo tôi nhiều năm trời.
Kim chỉ nam là nếu hôm nào tôi quá mỏi, tôi không muốn viết dạng nhật ký thì chỉ cần log trong vòng 10-20s là được, còn nếu mà hôm nào tôi có nhiều hứng để nói thì ngoài theo dõi sức khoẻ thể chất ra thì đây còn là một cuốn nhật kí, và từ cuốn nhật kí này thì có thể theo dõi được sức khoẻ tinh thằn và cũng như là hành trình phát triển của tôi.
Chắc là chỉ viết đến đây thôi, dạo này không động đến tiếng Hàn học tập nên chẳng biết còn chém gió ở trong nhật kí này bằng tiếng Hàn mượt không nữa, tôi có thể dùng 3 ngôn ngữ, nhưng AI thì có thể biết gần như là toàn bộ ngôn ngữ cơ, nên trong cuốn nhật kí này tôi có thể viết tuỳ theo cách của tôi mà không cần giới hạn lúc nào cũng là tiếng Anh hay tiếng Việt."",33.9","44.9"
